{
  "version":{"id":"ontology-v1","semver":"1.0.0","displayName":"正式本体","status":"approved","description":"生产版本","publishedAt":"2026-08-01T00:00:00Z","deprecatedAt":null,"retiredAt":null,"createdBy":"admin-1","createdAt":"2026-07-01T00:00:00Z","updatedAt":"2026-08-01T00:00:00Z"},
  "entities":[{"id":"entity-1","ontologyVersionId":"ontology-v1","businessKey":"project","displayName":"项目","description":"物业项目","status":"approved","fields":{"synonyms":["小区"],"parentBusinessKey":null,"metadata":{}},"createdAt":"2026-07-01T00:00:00Z","updatedAt":"2026-07-01T00:00:00Z"}],
  "metrics":[{"id":"metric-1","ontologyVersionId":"ontology-v1","businessKey":"collection-rate","displayName":"收缴率","description":"实收除以应收","status":"approved","fields":{"applicableSubjectKeys":["project"],"defaultAggregation":"ratio","unit":"percent","metadata":{}},"createdAt":"2026-07-01T00:00:00Z","updatedAt":"2026-07-01T00:00:00Z"}],
  "metricVariants":[{"id":"variant-1","ontologyVersionId":"ontology-v1","businessKey":"project-collection-rate","displayName":"项目收缴率","description":"项目口径","status":"approved","fields":{"parentMetricDefinitionId":"metric-1","semanticDiscriminator":"project-scope"},"createdAt":"2026-07-01T00:00:00Z","updatedAt":"2026-07-01T00:00:00Z"}],
  "factors":[{"id":"factor-1","ontologyVersionId":"ontology-v1","businessKey":"billing-timeliness","displayName":"账单及时性","description":"账单生成时效","status":"approved","fields":{"category":"billing"},"createdAt":"2026-07-01T00:00:00Z","updatedAt":"2026-07-01T00:00:00Z"}],
  "causalityEdges":[{"id":"edge-1","ontologyVersionId":"ontology-v1","businessKey":"billing-to-collection","displayName":"账单及时性影响收缴率","description":"治理边","status":"approved","fields":{"sourceEntityKey":"billing-timeliness","targetEntityKey":"collection-rate"},"createdAt":"2026-07-01T00:00:00Z","updatedAt":"2026-07-01T00:00:00Z"}],
  "planStepTemplates":[{"id":"step-1","ontologyVersionId":"ontology-v1","businessKey":"read-erp","displayName":"读取 ERP","description":"读取业务事实","status":"approved","fields":{"sortOrder":1},"createdAt":"2026-07-01T00:00:00Z","updatedAt":"2026-07-01T00:00:00Z"}],
  "toolBindings":[{"id":"binding-1","ontologyVersionId":"ontology-v1","businessKey":"erp.read-model","displayName":"ERP 事实读取","description":"ERP 事实读取","status":"approved","fields":{"boundStepTemplateKey":"read-erp","priority":100},"createdAt":"2026-07-01T00:00:00Z","updatedAt":"2026-07-01T00:00:00Z"}],
  "timeSemantics":[{"id":"time-1","ontologyVersionId":"ontology-v1","businessKey":"receivable-accounting-period","displayName":"应收账期","description":"应收统计时间","status":"approved","fields":{"semanticType":"accounting-period"},"createdAt":"2026-07-01T00:00:00Z","updatedAt":"2026-07-01T00:00:00Z"}],
  "evidenceTypes":[{"id":"evidence-1","ontologyVersionId":"ontology-v1","businessKey":"table-evidence","displayName":"表格证据","description":"量化表格","status":"approved","fields":{"evidenceCategory":"quantitative"},"createdAt":"2026-07-01T00:00:00Z","updatedAt":"2026-07-01T00:00:00Z"}],
  "capabilities":{"canView":true,"canAuthor":true,"canReview":true,"canPublish":true}
}
